{
  "id": "pim_rushlight",
  "name": "Pim Rushlight",
  "role": [
    "merchant",
    "giver"
  ],
  "town": "saltmere",
  "region": "fens",
  "look": "npc_pim",
  "portrait": "npc_pim",
  "dialogue": "pim",
  "knot": "pim_hub",
  "note": "A fen-folk chandler who sells lamp oil off a handcart by Saltmere's cistern, cheaper than Wendel, and wants Wendel told (world doc §3.2, v1.29). Gives The Sickpools."
}
